{
 "corpus_version": "owner-intent-control-v1.owner-intent-control-metamorphic-v1",
 "effort": "default",
 "engine": "opencode-go/longcat-2.0",
 "model": "opencode-go/longcat-2.0",
 "model_version": "longcat-2.0",
 "prompt_config_hash": "72a9552a654986b0bb856f52763496079c72aae993230f27e36f7ecb057adf1c",
 "role": "owner",
 "runner": "opencode"
}
